{
  "managers": [
    {
      "tokenAddress": "0xA0b86991c6218b36c1d19D4a2e9Eb0cE3606eB48",
      "managerAddress": "0xa14373a2209fAd5cDCc22841e9176E0ce4C50c17",
      "metadata": {
        "tokenName": "USD Coin",
        "tokenSymbol": "USDC",
        "network": "Ethereum Mainnet",
        "chainId": 1,
        "decimals": 6,
        "type": "Stablecoin",
        "setBy": "yaketh.eth",
        "notes": "USDC token manager updated to yaketh.eth transfer address"
      },
      "setAt": "2026-02-25T16:07:00.000Z",
      "updatedAt": "2026-03-08T21:52:56.156Z"
    },
    {
      "tokenAddress": "0xdAC17F958D2ee523a2206206994597C13D831ec7",
      "managerAddress": "0xa14373a2209fAd5cDCc22841e9176E0ce4C50c17",
      "metadata": {
        "tokenName": "Tether USD",
        "tokenSymbol": "USDT",
        "network": "Ethereum Mainnet",
        "chainId": 1,
        "decimals": 6,
        "type": "Stablecoin",
        "setBy": "yaketh.eth",
        "notes": "USDT token manager updated to yaketh.eth transfer address"
      },
      "setAt": "2026-02-25T17:22:18.131Z",
      "updatedAt": "2026-03-08T21:52:56.156Z"
    },
    {
      "tokenAddress": "0xC02aaA39b223FE8D0A0e5C4F27eAD9083C756Cc2",
      "managerAddress": "0xa14373a2209fAd5cDCc22841e9176E0ce4C50c17",
      "metadata": {
        "tokenName": "Wrapped Ether",
        "tokenSymbol": "WETH",
        "network": "Ethereum Mainnet",
        "chainId": 1,
        "decimals": 18,
        "type": "Wrapped Native Token",
        "setBy": "yaketh.eth",
        "notes": "WETH token manager updated to yaketh.eth transfer address"
      },
      "setAt": "2026-03-07T01:23:57.891Z",
      "updatedAt": "2026-03-08T21:52:56.156Z"
    },
    {
      "tokenAddress": "0xEe7aE85f2Fe2239E27D9c1E23fFFe168D63b4055",
      "managerAddress": "0xa14373a2209fAd5cDCc22841e9176E0ce4C50c17",
      "metadata": {
        "tokenName": "Token Contract",
        "tokenSymbol": "N/A",
        "network": "Ethereum Mainnet",
        "chainId": 1,
        "type": "Token Contract",
        "setBy": "yaketh.eth",
        "notes": "Token contract manager updated to yaketh.eth transfer address"
      },
      "setAt": "2026-02-25T16:44:38.681Z",
      "updatedAt": "2026-03-08T21:52:56.156Z"
    },
    {
      "tokenAddress": "0x0000000000000000000000000000000000000000",
      "managerAddress": "0x742d35Cc6634C0532925a3b844Bc9e7595f0bEb0",
      "metadata": {
        "tokenName": "Zero Address",
        "tokenSymbol": "NULL",
        "network": "Ethereum Mainnet",
        "chainId": 1,
        "type": "Special Address",
        "setBy": "kushmanmb.base.eth",
        "notes": "Immutable access permissions write for kushmanmb. Zero address used as sentinel value for application-level access control, not as token contract.",
        "purpose": "System-level permissions management",
        "securityNote": "Application-layer construct only, does not interact with on-chain contracts"
      },
      "setAt": "2026-04-06T04:01:56.577Z",
      "updatedAt": "2026-04-06T04:01:56.577Z"
    },
    {
      "tokenAddress": "0x0000000000000000000000000000000000000001",
      "managerAddress": "0x6fb9e80dDd0f5DC99D7cB38b07e8b298A57bF253",
      "metadata": {
        "tokenName": "Address One",
        "tokenSymbol": "ONE",
        "network": "Ethereum Mainnet",
        "chainId": 1,
        "type": "Special Address",
        "setBy": "system",
        "notes": "Full permissions write for 0x6fb9e80dDd0f5DC99D7cB38b07e8b298A57bF253. Address 1 used as sentinel value for application-level access control.",
        "purpose": "System-level permissions management",
        "securityNote": "Application-layer construct only, does not interact with on-chain contracts"
      },
      "setAt": "2026-04-06T04:14:30.669Z",
      "updatedAt": "2026-04-06T04:14:30.669Z"
    },
    {
      "tokenAddress": "0x0000000000000000000000000000000000000002",
      "managerAddress": "0xa14373a2209fAd5cDCc22841e9176E0ce4C50c17",
      "metadata": {
        "tokenName": "Gavah Token",
        "tokenSymbol": "GAVAH",
        "network": "All Networks",
        "chainId": 0,
        "decimals": 18,
        "type": "Governance Token",
        "setBy": "yaketh.eth",
        "notes": "Gavah Token manager for all contracts - Universal token manager managed by yaketh.eth",
        "purpose": "Universal governance and contract management",
        "scope": "All contracts in the repository",
        "contractPath": "contracts/GavahToken.sol"
      },
      "setAt": "2026-04-08T14:26:00.000Z",
      "updatedAt": "2026-04-08T14:26:00.000Z"
    }
  ],
  "deprecated": [
    {
      "tokenAddress": "0x63c0c19a282a1B52b07dD5a65b58948A07DAE32B",
      "managerAddress": "0x6fb9e80dDd0f5DC99D7cB38b07e8b298A57bF253",
      "deprecatedAt": "2026-03-08T21:52:56.156Z",
      "reason": "Unknown token with no valid symbol or name; removed from active configuration"
    }
  ],
  "transferAddress": "yaketh.eth",
  "transferAddressHex": "0xa14373a2209fAd5cDCc22841e9176E0ce4C50c17",
  "lastUpdated": "2026-04-08T14:26:00.000Z",
  "version": "1.4.0"
}
